{
  "schemaVersion": 1,
  "id": "n2_atico",
  "title": "Ático del coleccionista",
  "play": {
    "size": 6,
    "rooms": [
      [0, 0, 0, 0, 0, 0],
      [0, 0, 0, 0, 0, 0],
      [1, 1, 1, 2, 2, 2],
      [1, 1, 1, 2, 2, 2],
      [1, 1, 1, 2, 2, 2],
      [1, 1, 1, 2, 2, 2]
    ],
    "roomMeta": [
      { "id": 0, "name": "Galería", "short": "G", "token": "galeria" },
      { "id": 1, "name": "Biblioteca", "short": "B", "token": "biblioteca" },
      { "id": 2, "name": "Terraza", "short": "T", "token": "terraza" }
    ],
    "victim": { "r": 3, "c": 1 },
    "pawns": { "count": 3 },
    "objects": [
      {
        "id": "mesa",
        "shapeId": "tromino_L",
        "cells": [{ "dr": 0, "dc": 0 }, { "dr": 1, "dc": 0 }, { "dr": 1, "dc": 1 }]
      },
      {
        "id": "sofa",
        "shapeId": "tetromino_T",
        "cells": [{ "dr": 0, "dc": 0 }, { "dr": 0, "dc": 1 }, { "dr": 0, "dc": 2 }, { "dr": 1, "dc": 1 }]
      },
      {
        "id": "estanteria",
        "shapeId": "tromino_I",
        "cells": [{ "dr": 0, "dc": 0 }, { "dr": 1, "dc": 0 }, { "dr": 2, "dc": 0 }]
      }
    ],
    "edge": {
      "rows": [
        { "segments": [{ "roomId": 0, "count": 2 }], "people": 1, "objects": 1 },
        { "segments": [{ "roomId": 0, "count": 2 }], "people": 0, "objects": 2 },
        { "segments": [{ "roomId": 1, "count": 1 }, { "roomId": 2, "count": 3 }], "people": 1, "objects": 3 },
        { "segments": [{ "roomId": 1, "count": 2 }, { "roomId": 2, "count": 1 }], "people": 1, "objects": 2 },
        { "segments": [{ "roomId": 1, "count": 1 }, { "roomId": 2, "count": 0 }], "people": 0, "objects": 1 },
        { "segments": [{ "roomId": 1, "count": 1 }, { "roomId": 2, "count": 1 }], "people": 1, "objects": 1 }
      ],
      "cols": [
        { "segments": [{ "roomId": 0, "count": 2 }, { "roomId": 1, "count": 1 }], "people": 1, "objects": 2 },
        { "segments": [{ "roomId": 0, "count": 1 }, { "roomId": 1, "count": 1 }], "people": 1, "objects": 1 },
        { "segments": [{ "roomId": 0, "count": 0 }, { "roomId": 1, "count": 3 }], "people": 0, "objects": 3 },
        { "segments": [{ "roomId": 0, "count": 1 }, { "roomId": 2, "count": 1 }], "people": 1, "objects": 1 },
        { "segments": [{ "roomId": 0, "count": 0 }, { "roomId": 2, "count": 2 }], "people": 0, "objects": 2 },
        { "segments": [{ "roomId": 0, "count": 0 }, { "roomId": 2, "count": 2 }], "people": 1, "objects": 1 }
      ]
    }
  },
  "reveal": {
    "suspects": [
      { "pawnIndex": 0, "name": "Mar", "cell": { "r": 0, "c": 3 }, "must_room": 0 },
      { "pawnIndex": 1, "name": "Iris", "cell": { "r": 2, "c": 0 }, "must_room": 1 },
      { "pawnIndex": 2, "name": "Gus", "cell": { "r": 5, "c": 5 }, "must_room": 2 }
    ],
    "objects": {
      "mesa": "mesa de expositor",
      "sofa": "sofá de terraza",
      "estanteria": "estantería de coleccionista"
    },
    "culpritPawnIndex": 1
  }
}
