{
  "schemaVersion": 1,
  "id": "v3b_biblioteca",
  "title": "Biblioteca municipal",
  "play": {
    "size": 6,
    "rooms": [
      [0, 0, 0, 1, 1, 1],
      [0, 0, 0, 1, 1, 1],
      [0, 0, 0, 2, 2, 2],
      [0, 0, 0, 2, 2, 2],
      [0, 0, 0, 2, 2, 2],
      [0, 0, 0, 2, 2, 2]
    ],
    "roomMeta": [
      { "id": 0, "name": "Lectura", "short": "L", "token": "lectura" },
      { "id": 1, "name": "Archivo", "short": "A", "token": "archivo" },
      { "id": 2, "name": "Fondo", "short": "F", "token": "fondo" }
    ],
    "victim": { "r": 1, "c": 4 },
    "pawns": { "count": 3 },
    "objects": [
      {
        "id": "sofa",
        "shapeId": "tetromino_T",
        "cells": [{ "dr": 0, "dc": 0 }, { "dr": 0, "dc": 1 }, { "dr": 0, "dc": 2 }, { "dr": 1, "dc": 1 }]
      },
      {
        "id": "baul",
        "shapeId": "square_2x2",
        "cells": [{ "dr": 0, "dc": 0 }, { "dr": 0, "dc": 1 }, { "dr": 1, "dc": 0 }, { "dr": 1, "dc": 1 }]
      },
      {
        "id": "estanteria",
        "shapeId": "tromino_I",
        "cells": [{ "dr": 0, "dc": 0 }, { "dr": 1, "dc": 0 }, { "dr": 2, "dc": 0 }]
      }
    ],
    "edge": {
      "rows": [
        { "segments": [{ "roomId": 0, "count": 1 }, { "roomId": 1, "count": 1 }], "people": 2, "objects": 0 },
        { "segments": [{ "roomId": 0, "count": 1 }, { "roomId": 1, "count": 1 }], "people": 1, "objects": 1 },
        { "segments": [{ "roomId": 0, "count": 1 }, { "roomId": 2, "count": 1 }], "people": 1, "objects": 1 },
        { "segments": [{ "roomId": 0, "count": 1 }, { "roomId": 2, "count": 1 }], "people": 0, "objects": 2 },
        { "segments": [{ "roomId": 0, "count": 2 }, { "roomId": 2, "count": 2 }], "people": 0, "objects": 4 },
        { "segments": [{ "roomId": 0, "count": 2 }, { "roomId": 2, "count": 1 }], "people": 0, "objects": 3 }
      ],
      "cols": [
        { "segments": [{ "roomId": 0, "count": 2 }], "people": 0, "objects": 2 },
        { "segments": [{ "roomId": 0, "count": 2 }], "people": 0, "objects": 2 },
        { "segments": [{ "roomId": 0, "count": 4 }], "people": 1, "objects": 3 },
        { "segments": [{ "roomId": 1, "count": 1 }, { "roomId": 2, "count": 1 }], "people": 1, "objects": 1 },
        { "segments": [{ "roomId": 1, "count": 1 }, { "roomId": 2, "count": 3 }], "people": 1, "objects": 3 },
        { "segments": [{ "roomId": 1, "count": 0 }, { "roomId": 2, "count": 1 }], "people": 1, "objects": 0 }
      ]
    }
  },
  "reveal": {
    "suspects": [
      { "pawnIndex": 0, "name": "Nora", "cell": { "r": 0, "c": 2 }, "must_room": 0, "trait": "lectora habitual" },
      { "pawnIndex": 1, "name": "Iván", "cell": { "r": 0, "c": 3 }, "must_room": 1, "trait": "archivista" },
      { "pawnIndex": 2, "name": "Rita", "cell": { "r": 2, "c": 5 }, "role": "la auxiliar de depósito" }
    ],
    "objects": {
      "sofa": "sofá de la sala de fondo",
      "baul": "baúl de donaciones",
      "estanteria": "estantería de consulta"
    },
    "culpritPawnIndex": 1
  }
}
